keys,values
business news,business news today
business news,news releases
business news,latest business news
business news,business news articles
business news,current business news
business news,business wire news
business news,news press release
business news,business press release
business news,business news wire
business news,news press releases
business news,business press releases
press release,how to release a press release
press release,a press release
press release,release a press release
press release,release press release
globenewswire,globenewswire pricing
pr distribution,press release distribution canada
pr distribution,news release distribution
pr distribution,press distribution
pr distribution,pr press release
pr distribution,press releases distribution
pr distribution,press release distribution
pr distribution,pr release distribution
pr distribution,pr release
press release example,press release example for event
press release example,crisis press release example
press release example,example press release template
press release example,writing a press release example
press release example,press release example format
press release example,artist press release example
press release example,new release example
press release example,company press release example
press release example,what is a press release example
press release example,launch press release example
press release example,video press release example
press release example,press release format example
press release example,pr release example
press release example,how to write a press release example
press release example,example of a good press release
press release example,example event press release
press release example,template example press release
template for press release,sample press release template
template for press release,media press release template
template for press release,press release template for
template for press release,sample press release for
template for press release,press release sample template
template for press release,format for press release
template for press release,format for a press release
template for press release,press release for book
business wire,press release wire
business wire,business wire pricing
business wire,business wire press release
business wire,business wire press release pricing
business wire,business wire services
how to write a press release,how to write a press release for an event
how to write a press release,how to do a press release
how to write a press release,how to send press release
how to write a press release,how to format a press release
how to write a press release,how to make a press release
how to write a press release,how to write a good press release
how to write a press release,how to distribute a press release
how to write a press release,write a press release template
how to write a press release,how to submit a press release
how to write a press release,how to write a press release sample
how to write a press release,how to create a press release
how to write a press release,how to publish press release
how to write a press release,how to write an effective press release
how to write a press release,how to write a press release examples
how to write a press release,how to write a business press release
how to write a press release,how to write a press release template
how to write a press release,how to send a press release to media
how to write a press release,how to send a press release
how to write a press release,how write press release
how to write a press release,how to create press release
how to write a press release,write press release
how to write a press release,how to publish a press release
how to write a press release,how to press release
how to write a press release,press release how to
how to write a press release,how to do press release
how to write a press release,how to write a press release for a business
how to write a press release,how to write an event press release
format press release,press release format canada
format press release,press release format sample
format press release,press release format template
format press release,proper press release format
format press release,sample press release format
format press release,sample of press release format
format press release,press release sample format
format press release,format a press release
format press release,format for press release samples
format press release,sample format press release
format press release,format of press release
format press release,press releases format
format press release,press release format
social media listening,social media tracking
social media listening,social media listening tools
social media listening,social media press release template
what is a press release,what is press release
sample press release,press release sample pdf
sample press release,writing a press release sample
sample press release,sample press release email
sample press release,sample of press releases
sample press release,press release sample
sample press release,a press release sample
sample press release,sample press releases
sample press release,sample of a press release
sample press release,sample press release templates
sample press release,sample of press release
media monitoring,social media monitoring tool
media monitoring,media monitoring services
media monitoring,media press release
media monitoring,top media monitoring services
media monitoring,media monitoring system
press release canada,newswire canada
press release canada,canada newswires
press release canada,canada newswire
press release canada,canada news wire
press release canada,prnewswire canada
press release canada,canada wire
press release canada,pr newswire canada
press release canada,free press release distribution canada
media analytics,public relations analytics
canadian newswire,canadian press release distribution
canadian newswire,canadian wire
marketwired,marketwired pricing
pr services,press release services
pr services,press wire services
distribute a press release,how do you distribute a press release
distribute a press release,distribute news release
distribute a press release,distribute press releases
public relations strategies,public relations service
public relations strategies,public relations tools
public relations strategies,public relations tactics
public relations strategies,public relations websites
public relations strategies,public relations wire
public relations strategies,public relations software
pr web,web press release
new website launch,website press release
new website launch,new website press release
new website launch,website launch press release
new website launch,launch press release
new website launch,press release website
pr tools,pr monitoring tools
pr tools,pr measurement tools
pr tools,pr software tools
media tracking,media tracking services
press release distribution service,news release service
press release distribution service,press release service
press release distribution service,press release service online
press release company,company press release
media database,pr media database
media database,pr database
media database,social media influencer database
free press release template,free press release services
press release word template,word press release template
press release word template,press release template word
music press release,music press release template
structure of a press release,press release structure
press release for immediate release,press release immediate
where to send a press release,where to publish press releases
where to send a press release,who to send press release to
where to send a press release,send press release
where to send a press release,where to submit press releases
where to send a press release,where submit press release
where to send a press release,send a press release
where to send a press release,press release send
where to send a press release,where to send press releases
submit press release,submit your press release
submit press release,submit press release to
submit press release,submit a press release
submit press release,press release submit
submit press release,submit press releases
press release email template,email press release
press release email template,how to send a press release email
press release email template,send press release email
press release email template,press release email
new hire press release,press release new hire
book press release,new book press release
book press release,book press releases
sample of a press release for an event,press release for an event
new product press release,product launch press release
new product press release,product press release
new product press release,press release new business
new product press release,product press release template
best time to send a press release,best press release
press release cost,how much does a press release cost
press release cost,how much cost press release
media contacts list,press contacts
media contacts list,pr media list
media contacts list,press release list
media contacts list,list of press contacts
media clipping,media clipping services
writing a great press release,writing a press release template
writing a great press release,writing a press release
writing a great press release,writing press release
pr websites,best press release websites
pr websites,press release websites
press release online,create press release online
press release online,online press release template
press release online,online press release sites
press release online,online press release
best press release template,best press release examples
best press release template,press release best practices
how do I do a press release,how do press release
top press release sites,press release sites
digital press release,digital press release template
publish press release,publish a press release
ap style press release,ap press release
ap style press release,ap style press release sample
ap style press release,ap press releases
how to send out a press release,send out a press release
how to send out a press release,how to get a press release out
how to send out a press release,send out press release
create a press release,create press release
grand opening press release,press release opening
examples of good press releases,good press release
examples of good press releases,good press release examples
new ceo press release,ceo press release
non profit press release,press release non profit
how to issue a press release,issue a press release
how to issue a press release,issue press release
fashion press release,fashion show press release
press release writing tips,press release tips
artist press release,press release artist
press release submission sites,pr submission
press release submission sites,press release submission
new employee press release,new employee announcement press release
press release art,art press release
post press release,how to post a press release
press release event announcement,event press release
press release event announcement,press release announcement
make a press release,make press release
make a press release,how make press release
pr businesswire,businesswire
cheap press releases,release press releases
advisory board press release,board press release
how to prepare a press release,how prepare press release
how to prepare a press release,prepare press release
journalist list,journalist contacts
pr metrics,pr success metrics
sending press release,sending press releases
sending press release,sending press releases to
press releases samples,press release samples
press releases samples,event press release samples
posting a press release,press release posting
